heatmap_id,rank,source_row_id,title_or_label,url,result_type,domain_class,authority_score_0_15,search_power_score_0_15,semantic_hardening_score_0_15,category_collapse_score_0_15,emotional_identity_score_0_10,recirculation_score_0_10,citation_opacity_score_0_10,incentive_visibility_score_0_10,linear_power_score_0_100,exponential_strength_index,heat_band,priority_lane,audience_surface,correction_opportunity_score_0_100,recommended_counter_asset,observed_claim_text,source_cited,hardens_un_claim,category_collapse,capture_status,notes
TOP-056,56,SEO-N056,Wikidata Sri Lankan civil war,https://www.wikidata.org/wiki/Q213394,knowledge_graph,knowledge_graph,15,11,0,0,3,6,8,4,47,26.0,grey_low_or_supporting,wikipedia_mirror_kg,editors_students_journalists_ai_snippets,65,evidence_packet_link,structured broad-war death property without careful final-phase category labels,,NO,,,Knowledge-graph denominator expansion route.
TOP-077,77,CSCW-001,Casualties of the Sri Lankan civil war / lead_quote,https://en.wikipedia.org/wiki/Casualties_of_the_Sri_Lankan_civil_war,wikipedia_audit_row,wikipedia,15,11,0,0,3,6,8,4,47,26.0,grey_low_or_supporting,wikipedia_mirror_kg,editors_students_journalists_ai_snippets,65,citation_audit_talk_page_packet_plus_source_chain_visual,lead preserves exact UN Panel wording,,NO,,,Best current Wikipedia preservation of the cautious wording.
TOP-078,78,CSCW-002,Casualties of the Sri Lankan civil war / table_ranges,https://en.wikipedia.org/wiki/Casualties_of_the_Sri_Lankan_civil_war,wikipedia_audit_row,wikipedia,15,11,0,0,3,6,8,4,47,26.0,grey_low_or_supporting,wikipedia_mirror_kg,editors_students_journalists_ai_snippets,65,citation_audit_talk_page_packet_plus_source_chain_visual,9257-140000 and 13084-75000 ranges appear in tables,,NO,,,Tables create wide false-continuum risk.
TOP-079,79,CSCW-003,Casualties of the Sri Lankan civil war / source_note,https://en.wikipedia.org/wiki/Casualties_of_the_Sri_Lankan_civil_war,wikipedia_audit_row,wikipedia,15,11,0,0,3,6,8,4,47,26.0,grey_low_or_supporting,wikipedia_mirror_kg,editors_students_journalists_ai_snippets,65,citation_audit_talk_page_packet_plus_source_chain_visual,one note says BBC source does not support claim,,NO,,,Useful proof that the page already contains internal source tension.
TOP-080,80,WCFS-001,War crimes during the final stages of the Sri Lankan civil war / accountability_hub,https://en.wikipedia.org/wiki/War_crimes_during_the_final_stages_of_the_Sri_Lankan_civil_war,wikipedia_audit_row,wikipedia,15,11,0,0,3,6,8,4,47,26.0,grey_low_or_supporting,wikipedia_mirror_kg,editors_students_journalists_ai_snippets,65,citation_audit_talk_page_packet_plus_source_chain_visual,war-crimes page routes users into casualty and hospital-shelling evidence,,NO,,,Important adjacent hub for narrative authority even without a single dominant death number.
TOP-085,85,SERP-085,Genocide memorial/advocacy sites and Wikipedia dominate,https://genocideagainsttamils.com/massacres/mullivaikkal-2009/,advocacy seo,advocacy seo,10,7,0,0,8,6,8,8,47,26.0,grey_low_or_supporting,other_surface,diaspora_community_readers_campaigners,53,claim_table_with_source_wording_and_category_labels,Genocide memorial/advocacy sites and Wikipedia dominate,,UNKNOWN,,,Often uses source lists rather than sentence-level footnotes.
TOP-001,1,SEO-N001,UN Panel 2011,https://www.law.umich.edu/facultyhome/drwcasebook/Documents/Documents/Report%20of%20the%20Panel%20of%20Experts%20on%20Accountability%20in%20Sri%20Lanka.pdf,source,UN,15,14,0,0,3,2,8,4,46,24.3,grey_low_or_supporting,source_authority,general_search_readers,68,evidence_packet_link,up to 40000 civilian deaths could not be ruled out,,NO,,,Origin source; cautious final-phase/Vanni wording.
TOP-003,3,SEO-N003,OISL 2015,https://www.ohchr.org/sites/default/files/documents/hrbodies/hrcouncil/sessions-regular/session30/documents/a-hrc-30-crp-2.pdf,source,UN,15,14,0,0,3,2,8,4,46,24.3,grey_low_or_supporting,source_authority,general_search_readers,68,evidence_packet_link,serious allegations and incident patterns in the final phase,,NO,,,"Strong for shelling, hospitals, deprivation, and accountability; not a total casualty count."
TOP-030,30,SEO-N030,ProPublica PEARL 990,https://projects.propublica.org/nonprofits/organizations/263697312,filing,funding,15,10,0,0,3,2,8,8,46,24.3,grey_low_or_supporting,source_authority,investigators_transparency_readers,63,transparency_note_separating_capacity_from_causation,2023 revenue 107122 expenses 179739,,NO,,,Funding visibility only.
TOP-032,32,SEO-N032,BTF company route,https://find-and-update.company-information.service.gov.uk/company/11829919,filing,funding,15,10,0,0,3,2,8,8,46,24.3,grey_low_or_supporting,source_authority,investigators_transparency_readers,63,transparency_note_separating_capacity_from_causation,active UK membership organisation route,,NO,,,"Corporate existence, not causal proof."
TOP-033,33,SEO-N033,TGTE Canada corporation,https://www.canadacompanyregistry.com/companies/transnational-government-of-tamil-eelam-inc/,filing,funding,15,10,0,0,3,2,8,8,46,24.3,grey_low_or_supporting,source_authority,investigators_transparency_readers,63,transparency_note_separating_capacity_from_causation,active non-soliciting Canada corporation,,NO,,,Political diaspora organization route.
TOP-059,59,SEO-N059,MFA hosted counter-piece on 7721 and 40000,https://mfa.gov.lk/sin/un-sidesteps-query-on-721-deaths/,official_counter,state_official,15,9,0,0,3,2,8,8,45,22.6,grey_low_or_supporting,counter_route,sri_lankan_civic_readers_state_media_counter_campaigns,61,counter_route_audit_showing_lower_count_limits,7721 deaths including LTTE combatants,,NO,,,Category-discipline route used rhetorically as counter to high estimates.
TOP-060,60,SEO-N060,Defence.lk lower-count rebuttal,https://www.defence.lk/Article/view_article/845,official_counter,state_official,15,9,0,0,3,2,8,8,45,22.6,grey_low_or_supporting,counter_route,sri_lankan_civic_readers_state_media_counter_campaigns,61,counter_route_audit_showing_lower_count_limits,less than 8000 deaths which includes LTTE dead,,NO,,,"Blends skeletal-remains rhetoric, missing-persons critique, and lower counts."
TOP-061,61,SEO-N061,Defence.lk Lord Naseby route,https://www.defence.lk/Article/view_article/840,official_counter,state_official,15,9,0,0,3,2,8,8,45,22.6,grey_low_or_supporting,counter_route,sri_lankan_civic_readers_state_media_counter_campaigns,61,counter_route_audit_showing_lower_count_limits,40000 deaths did not take place,,NO,,,Official repackaging of the UK parliamentary lower-count lane.
TOP-062,62,SEO-N062,MFA Lord Naseby 2021 route,https://mfa.gov.lk/sin/lord-naseby-sl-genocide/,official_counter,state_official,15,9,0,0,3,2,8,8,45,22.6,grey_low_or_supporting,counter_route,sri_lankan_civic_readers_state_media_counter_campaigns,61,counter_route_audit_showing_lower_count_limits,maximum of 6000 to 7000 deaths,,NO,,,Core lower-count official counter node.
TOP-063,63,SEO-N063,MFA Narrative III methodology critique,https://mfa.gov.lk/sin/the-last-stages-of-the-war-in-sri-lanka-narrative-iii/,official_counter,state_official,15,9,0,0,3,2,8,8,45,22.6,grey_low_or_supporting,counter_route,sri_lankan_civic_readers_state_media_counter_campaigns,61,counter_route_audit_showing_lower_count_limits,to question the methodology,,NO,,,Intellectual counter-route distinct from direct denial.
TOP-084,84,SERP-084,Tamil Guardian 2026 and PEARL/ITJP routes appear,https://www.tamilguardian.com/content/pictures-tamil-genocide-remembrance-day-commemorated-mullivaikkal-0,tamil media/community,tamil media/community,15,9,0,0,3,6,8,4,45,22.6,grey_low_or_supporting,source_authority,journalists_general_readers_explainer_creators,61,editor_note_pitch_with_precise_safe_wording,Tamil Guardian 2026 and PEARL/ITJP routes appear,,UNKNOWN,,,Search result says 169796 unaccounted and presumed dead; category must remain visible.
TOP-093,93,SERP-093,Ontario legislative and debate routes appear with genocide framing and number stacks,https://www.ola.org/en/legislative-business/bills/parliament-42/session-1/bill-104,host-government,host-government,14,7,0,0,8,4,8,4,45,22.6,grey_low_or_supporting,other_surface,general_search_readers,57,evidence_packet_link,Ontario legislative and debate routes appear with genocide framing and number stacks,,UNKNOWN,,,Political recognition surfaces can harden disputed numeric bundles.
TOP-025,25,SEO-N025,Groundviews 2014 counter lane,https://groundviews.org/2014/04/10/generating-calamity-2008-2014-an-overview-of-tamil-nationalist-operations-and-their-marvels/,counter,counter_narrative,15,12,0,0,3,2,8,4,44,21.1,grey_low_or_supporting,source_authority,sri_lankan_civic_readers_state_media_counter_campaigns,64,counter_route_audit_showing_lower_count_limits,40k turned into definitive figure,,NO,,,Useful but polemical adversarial node.
TOP-094,94,SERP-094,"WIKI2, The Diplomat, and memorial pages appear with declarative death wording",https://wiki2.org/en/Mullivaikkal_massacre,mirror/media,mirror/media,12,11,0,0,3,6,8,4,44,21.1,grey_low_or_supporting,media,journalists_general_readers_explainer_creators,59,editor_note_pitch_with_precise_safe_wording,"WIKI2, The Diplomat, and memorial pages appear with declarative death wording",,UNKNOWN,,,Good query for finding mid-authority compression nodes.
TOP-038,38,SEO-N038,The Diplomat 2020 remembrance article,https://thediplomat.com/2020/05/sri-lankas-war-victims-still-await-justice/,article,international_media,12,10,0,0,3,6,8,4,43,19.7,grey_low_or_supporting,media,journalists_general_readers_explainer_creators,57,editor_note_pitch_with_precise_safe_wording,up to 40000 civilians may have been killed in the last stages of the war,,NO,,,High-authority international commentary surface.
TOP-097,97,SERP-097,Petitions and memorial campaigns surface genocide and 40000 language even when not numerically rigorous,https://www.change.org/p/recognize-the-tamil-genocide-and-support-justice-for-the-tamil-people,petition/advocacy,petition/advocacy,10,7,0,0,8,2,8,8,43,19.7,grey_low_or_supporting,other_surface,diaspora_community_readers_campaigners,50,claim_table_with_source_wording_and_category_labels,Petitions and memorial campaigns surface genocide and 40000 language even when not numerically rigorous,,UNKNOWN,,,Useful node family for later crawl even if not all petition pages are top-tier authority.
TOP-099,99,SERP-099,Institutional memorial pages appear with declarative massacre wording and 40000 estimates,https://www.cipdh.gob.ar/memorias-situadas/en/lugar-de-memoria/mullivaikkal-remembrance-day/,institutional memorial,institutional memorial,10,7,0,0,8,6,8,4,43,19.7,grey_low_or_supporting,advocacy_memorial,diaspora_community_readers_campaigners,50,evidence_packet_link,Institutional memorial pages appear with declarative massacre wording and 40000 estimates,,UNKNOWN,,,Shows movement from media/NGO phrasing into institutional memory platforms.
TOP-014,14,SEO-N014,ICG War Crimes in Sri Lanka,https://www.crisisgroup.org/sites/default/files/191-war-crimes-in-sri-lanka.pdf,report,ngo,13,12,0,0,3,2,8,4,42,18.4,grey_low_or_supporting,ngo_legal_evidence,human_rights_readers_fact_checkers_editors,60,claim_table_with_source_wording_and_category_labels,tens of thousands killed and war-crimes inquiry needed,,NO,,,Pattern authority more than numeric precision.
TOP-086,86,SERP-086,ICG article and republished copies appear,https://www.lankastandard.com/2012/02/sri-lanka-s-dead-and-missing-the-need-for-an-accounting/,ngo/republished analysis,ngo/republished analysis,15,9,0,0,3,2,8,4,41,17.1,grey_low_or_supporting,ngo_legal_evidence,human_rights_readers_fact_checkers_editors,58,claim_table_with_source_wording_and_category_labels,ICG article and republished copies appear,,UNKNOWN,,,Good bridge for DCS lower figures and missing-population questions.
TOP-090,90,SERP-090,Tamil Guardian and commission PDFs appear,https://www.tamilguardian.com/content/paranagama-report-rejects-40000-death-toll-estimate-blames-ltte-civilian-deaths,media/counter-report,media/counter-report,15,9,0,0,3,2,8,4,41,17.1,grey_low_or_supporting,source_authority,sri_lankan_civic_readers_state_media_counter_campaigns,58,counter_route_audit_showing_lower_count_limits,Tamil Guardian and commission PDFs appear,,UNKNOWN,,,"Use Paranagama PDF directly for argument, not only media summary."
TOP-019,19,SEO-N019,ICRC Vanni case study,https://casebook.icrc.org/case-study/sri-lanka-conflict-vanni,case_study,humanitarian,13,10,0,0,3,2,8,4,40,16.0,grey_low_or_supporting,ngo_legal_evidence,human_rights_readers_fact_checkers_editors,56,evidence_packet_link,250000 civilians trapped / evacuations and relief obstruction,,NO,,,"Context authority, not a casualty total."
TOP-026,26,SEO-N026,Groundviews 2026 reflection,https://groundviews.org/2026/05/18/seventeen-years-after-mullivaikkal-reconsidering-justice-and-political-strategy/,article,independent_commentary,15,8,0,0,3,2,8,4,40,16.0,grey_low_or_supporting,media,journalists_general_readers_explainer_creators,57,editor_note_pitch_with_precise_safe_wording,remembrance remains necessary but diaspora guarantees and externalism are criticized,,NO,,,Useful for current debate framing and caution against overreliance on outside narratives.
TOP-088,88,SERP-088,Wikipedia/mirrors likely dominate,https://everything.explained.today/Mullivaikkal_massacre/,seo mirror,seo mirror,8,11,0,0,3,6,8,4,40,16.0,grey_low_or_supporting,other_surface,general_search_readers,50,evidence_packet_link,Wikipedia/mirrors likely dominate,,UNKNOWN,,,Mirror duplicates Wikipedia and creates false plurality.
TOP-091,91,SERP-091,Wikimili and WIKI2 style mirrors appear around Wikipedia and memorial routes,https://wikimili.com/en/Mullivaikkal_massacre,seo mirror,seo mirror,8,11,0,0,3,6,8,4,40,16.0,grey_low_or_supporting,other_surface,general_search_readers,50,evidence_packet_link,Wikimili and WIKI2 style mirrors appear around Wikipedia and memorial routes,,UNKNOWN,,,Useful for mirror-family expansion in round 2.
TOP-096,96,SERP-096,Video and documentary routes surface the number via Channel 4 and remembrance clips,https://www.basementfilms.co.uk/work/sri-lankas-killing-fields,video/documentary,video/documentary,12,7,0,0,3,6,8,4,40,16.0,grey_low_or_supporting,social_video,social_users_creators_commenters,51,short_shareable_fact_check_card_and_comment_template,Video and documentary routes surface the number via Channel 4 and remembrance clips,,UNKNOWN,,,Video surfaces likely matter more as search snippets and embeds than as raw transcripts.
TOP-015,15,SEO-N015,LLRC final report,https://www.peace-srilanka.org/images/publications/LLRC-Report-in-Sri-lanka.pdf,report,state_or_domestic_commission,8,10,0,0,3,2,8,8,39,14.9,grey_low_or_supporting,counter_route,sri_lankan_civic_readers_state_media_counter_campaigns,49,counter_route_audit_showing_lower_count_limits,records disputed figures and says totals were not verified,,NO,,,Counter-route of caution and domestic review.
TOP-018,18,SEO-N018,DCS EVE-2011,https://www.statistics.gov.lk/Resource/en/Population/Vital_Statistics/EVE2011_FinalReport.pdf,report,state_statistics,8,10,0,0,3,2,8,8,39,14.9,grey_low_or_supporting,counter_route,sri_lankan_civic_readers_state_media_counter_campaigns,49,counter_route_audit_showing_lower_count_limits,8998 deaths / 2635 untraceable in Jan-May 2009 tables,,NO,,,Official lower enumeration route.
TOP-031,31,SEO-N031,Global Tamil Forum about,https://www.globaltamilforum.org/about-us.aspx,organization,diaspora_advocacy,10,8,0,0,3,2,8,8,39,14.9,grey_low_or_supporting,advocacy_memorial,diaspora_community_readers_campaigners,49,claim_table_with_source_wording_and_category_labels,non-violent international advocacy organization,,NO,,,Organizational presence in the advocacy ecosystem.
TOP-098,98,SERP-098,Accounting and memorial routes appear and often bridge ICG/Petrie language into activist summaries,https://srilankabrief.org/sri-lankas-dead-and-missing-the-need-for-an-accounting/,republished analysis,republished analysis,15,7,0,0,3,2,8,4,39,14.9,grey_low_or_supporting,other_surface,general_search_readers,55,evidence_packet_link,Accounting and memorial routes appear and often bridge ICG/Petrie language into activist summaries,,UNKNOWN,,,Important for tracking how unaccounted language travels.
TOP-089,89,SERP-089,Recent Reddit and social pages repeat range,https://www.reddit.com/r/srilanka/comments/1tgd35u/lets_get_this_straight_if_youre_here_to_troll_or/,social/forum,social/forum,7,7,0,0,3,5,8,8,38,13.9,grey_low_or_supporting,social_video,social_users_creators_commenters,43,short_shareable_fact_check_card_and_comment_template,Recent Reddit and social pages repeat range,,UNKNOWN,,,Social layer often cites UN for 40-70k range without category precision.
TOP-095,95,SERP-095,Multiple Reddit debate/explainer pages appear and often convert layered estimates into simple certainty,https://www.reddit.com/r/srilanka/comments/1j8wsym/what_is_mullivaikal_massacre/,social/forum,social/forum,7,7,0,0,3,5,8,8,38,13.9,grey_low_or_supporting,social_video,social_users_creators_commenters,43,short_shareable_fact_check_card_and_comment_template,Multiple Reddit debate/explainer pages appear and often convert layered estimates into simple certainty,,UNKNOWN,,,Need comment-level capture because some threads partially correct the headline claim.
TOP-047,47,SEO-N047,Basement Films Killing Fields route,https://www.basementfilms.co.uk/work/sri-lankas-killing-fields,video_route,documentary_media,12,8,0,0,3,2,8,4,37,13.0,grey_low_or_supporting,social_video,social_users_creators_commenters,50,short_shareable_fact_check_card_and_comment_template,allegations that up to 40000 civilians died in the final weeks,,NO,,,Documentary authority node that later feeds compression.
TOP-034,34,SEO-N034,Meta Ad Library,https://www.facebook.com/ads/library,ad_transparency,platform,8,8,0,0,3,5,8,4,36,12.1,grey_low_or_supporting,other_surface,general_search_readers,44,evidence_packet_link,search route for issue and political ads,,NO,,,Correct route to test paid amplification; no result capture yet.
TOP-081,81,SERP-081,UN Panel/Wikipedia/Ilankai Tamil Sangam preserve exact cautious phrase,https://sangam.org/2011/04/Extracts_Experts_Report.php?uid=4320,primary-extract/republication,primary-extract/republication,8,7,0,0,3,6,8,4,36,12.1,grey_low_or_supporting,other_surface,general_search_readers,43,evidence_packet_link,UN Panel/Wikipedia/Ilankai Tamil Sangam preserve exact cautious phrase,,UNKNOWN,,,Useful for exact wording but cite original UN Panel where possible.
TOP-087,87,SERP-087,BBC via ecoi and DCS routes appear,https://www.ecoi.net/en/document/1220635.html,media/official summary,media/official summary,12,7,0,0,3,2,8,4,36,12.1,grey_low_or_supporting,counter_route,sri_lankan_civic_readers_state_media_counter_campaigns,49,editor_note_pitch_with_precise_safe_wording,BBC via ecoi and DCS routes appear,,UNKNOWN,,,Useful for official lower estimate; needs direct DCS PDF for tables.
TOP-035,35,SEO-N035,Google Ads Transparency Center,https://adstransparency.google.com/,ad_transparency,platform,8,8,0,0,3,2,8,4,33,9.8,grey_low_or_supporting,other_surface,general_search_readers,42,evidence_packet_link,search route for search and video ads,,NO,,,Correct route to test paid search/video amplification; no result capture yet.
