heatmap_id,rank,source_row_id,title_or_label,url,result_type,domain_class,authority_score_0_15,search_power_score_0_15,semantic_hardening_score_0_15,category_collapse_score_0_15,emotional_identity_score_0_10,recirculation_score_0_10,citation_opacity_score_0_10,incentive_visibility_score_0_10,linear_power_score_0_100,exponential_strength_index,heat_band,priority_lane,audience_surface,correction_opportunity_score_0_100,recommended_counter_asset,observed_claim_text,source_cited,hardens_un_claim,category_collapse,capture_status,notes
TOP-005,5,SEO-N005,Wikipedia Mullivaikkal massacre,https://en.wikipedia.org/wiki/Mullivaikkal_massacre,hub,wikipedia,15,15,15,0,8,6,8,4,71,137.2,red_critical_authority_hardening,wikipedia_mirror_kg,editors_students_journalists_ai_snippets,85,citation_audit_talk_page_packet_plus_source_chain_visual,40000-70000 fatalities / according to UN,,YES,,,High-risk infobox and lead hardening.
TOP-006,6,SEO-N006,Wikipedia Tamil genocide,https://en.wikipedia.org/wiki/Tamil_genocide,hub,wikipedia,15,15,15,0,8,6,8,4,71,137.2,red_critical_authority_hardening,wikipedia_mirror_kg,editors_students_journalists_ai_snippets,85,citation_audit_talk_page_packet_plus_source_chain_visual,169796 killed; 40000-70000 killed and unaccounted,,YES,,,Strong category collapse and legal-frame merger.
TOP-010,10,SEO-N010,DBpedia Mullivaikkal massacre,https://dbpedia.org/resource/Mullivaikkal_massacre,mirror,knowledge_graph,15,15,15,0,8,6,8,4,71,137.2,red_critical_authority_hardening,wikipedia_mirror_kg,editors_students_journalists_ai_snippets,85,evidence_packet_link,semantic mirror of Wikipedia event node,,YES,,,Machine-readable graph amplification.
TOP-007,7,SEO-N007,Wikipedia Mullivaikkal Remembrance Day,https://en.wikipedia.org/wiki/Mullivaikkal_Remembrance_Day,hub,wikipedia,15,15,8,0,8,10,8,4,68,111.4,orange_high_priority,wikipedia_mirror_kg,editors_students_journalists_ai_snippets,83,citation_audit_talk_page_packet_plus_source_chain_visual,as many as 40000 may have been killed,,MILD,,,Annual remembrance recirculation node.
TOP-042,42,SEO-N042,Ontario Hansard Bill 104 debate,https://www.ola.org/en/legislative-business/house-documents/parliament-42/session-2/2021-05-06/hansard,political_recognition,host_government,14,10,15,0,8,4,8,8,67,104.0,orange_high_priority,political_recognition,policy_staff_diaspora_civic_educators,75,briefing_note_for_political_recognition_vs_casualty_method,40000 to 146679 Tamils perished in the genocide,,YES,,,Legislative debate hardens disputed numeric cluster.
TOP-043,43,SEO-N043,Ontario Hansard memorial debate 2019,https://www.ola.org/en/legislative-business/house-documents/parliament-42/session-1/2019-05-16/hansard,political_recognition,host_government,14,10,15,0,8,4,8,8,67,104.0,orange_high_priority,political_recognition,policy_staff_diaspora_civic_educators,75,briefing_note_for_political_recognition_vs_casualty_method,40000 to 146679 civilians killed during the genocide,,YES,,,Earlier recognition-era number hardening lane.
TOP-052,52,SEO-N052,Wikipedia list of massacres in Sri Lanka,https://en.wikipedia.org/wiki/List_of_massacres_in_Sri_Lanka,list_hub,wikipedia,15,11,15,0,8,6,8,4,67,104.0,orange_high_priority,wikipedia_mirror_kg,editors_students_journalists_ai_snippets,78,citation_audit_talk_page_packet_plus_source_chain_visual,Mulivaikal massacre 40000-70000,,YES,,,Taxonomy/list page that hardens event framing.
TOP-064,64,SEO-N064,Brampton proclamation 2024,https://www1.brampton.ca/EN/City-Hall/Protocol-Office/2024%20Proclamations/Tamil%20Genocide%20Day-05.18.2024.pdf,political_recognition,municipal_government,15,9,15,0,8,4,8,8,67,104.0,orange_high_priority,source_authority,policy_staff_diaspora_civic_educators,75,briefing_note_for_political_recognition_vs_casualty_method,over 40000 Tamil civilians lost their lives during the last stages,,YES,,,Municipal-recognition node with strong civic legitimacy effect.
TOP-069,69,MM-001,Mullivaikkal massacre / infobox_fatalities,https://en.wikipedia.org/wiki/Mullivaikkal_massacre,wikipedia_audit_row,wikipedia,15,11,15,0,8,6,8,4,67,104.0,orange_high_priority,wikipedia_mirror_kg,editors_students_journalists_ai_snippets,78,citation_audit_talk_page_packet_plus_source_chain_visual,40000-70000 fatalities,,YES,,,Most aggressive high-authority compression lane in the current Wikipedia set.
TOP-070,70,MM-002,Mullivaikkal massacre / lead_sentence,https://en.wikipedia.org/wiki/Mullivaikkal_massacre,wikipedia_audit_row,wikipedia,15,11,15,0,8,6,8,4,67,104.0,orange_high_priority,wikipedia_mirror_kg,editors_students_journalists_ai_snippets,78,citation_audit_talk_page_packet_plus_source_chain_visual,according to the UN between 40000 and 70000 entrapped Tamil civilians were killed,,YES,,,UN is presented as if it directly supports the combined range.
TOP-071,71,MM-003,Mullivaikkal massacre / citation_stack,https://en.wikipedia.org/wiki/Mullivaikkal_massacre,wikipedia_audit_row,wikipedia,15,11,15,0,8,6,8,4,67,104.0,orange_high_priority,wikipedia_mirror_kg,editors_students_journalists_ai_snippets,78,citation_audit_talk_page_packet_plus_source_chain_visual,event page uses multi-source authority pileup,,YES,,,Stacking creates false impression of multiple independent recounts.
TOP-072,72,TG-001,Tamil genocide / infobox_totals,https://en.wikipedia.org/wiki/Tamil_genocide,wikipedia_audit_row,wikipedia,15,11,15,0,8,6,8,4,67,104.0,orange_high_priority,wikipedia_mirror_kg,editors_students_journalists_ai_snippets,78,citation_audit_talk_page_packet_plus_source_chain_visual,154022-253818 total / 169796 killed in Jan-May 2009,,YES,,,Highest category-collapse page in the current graph.
TOP-073,73,TG-002,Tamil genocide / casualty_row,https://en.wikipedia.org/wiki/Tamil_genocide,wikipedia_audit_row,wikipedia,15,11,15,0,8,6,8,4,67,104.0,orange_high_priority,wikipedia_mirror_kg,editors_students_journalists_ai_snippets,78,citation_audit_talk_page_packet_plus_source_chain_visual,40000-70000 killed and unaccounted,,YES,,,Deaths and unaccounted are merged in reader perception.
TOP-066,66,SEO-N066,Scottish Parliament motion S6M-19300,https://www.parliament.scot/chamber-and-committees/votes-and-motions/S6M-19300,political_recognition,host_government,14,9,15,0,8,4,8,8,66,97.0,orange_high_priority,political_recognition,policy_staff_diaspora_civic_educators,73,briefing_note_for_political_recognition_vs_casualty_method,"estimated 70000 to 146000 Tamil civilians, as documented by the UN and international human rights organisations",,YES,,,Very strong political hardening and authority inflation node.
TOP-028,28,SEO-N028,Canada PM statement 2026,https://www.pm.gc.ca/en/news/statements/2026/05/18/statement-prime-minister-carney-tamil-genocide-remembrance-day,political_recognition,host_government,14,10,8,0,8,8,8,8,64,84.4,gold_watch_and_correct,political_recognition,policy_staff_diaspora_civic_educators,73,briefing_note_for_political_recognition_vs_casualty_method,atrocities against Tamils recognized as genocide by Parliament in 2022,,MIXED,,,Political recognition node; not a legal tribunal.
TOP-075,75,MRD-001,Mullivaikkal Remembrance Day / lead_sentence,https://en.wikipedia.org/wiki/Mullivaikkal_Remembrance_Day,wikipedia_audit_row,wikipedia,15,11,8,0,8,10,8,4,64,84.4,gold_watch_and_correct,wikipedia_mirror_kg,editors_students_journalists_ai_snippets,76,citation_audit_talk_page_packet_plus_source_chain_visual,UN report found as many as 40000 Tamil civilians may have been killed in final months,,MILD,,,Media mediation replaces direct primary citation.
TOP-076,76,MRD-002,Mullivaikkal Remembrance Day / recurrence_effect,https://en.wikipedia.org/wiki/Mullivaikkal_Remembrance_Day,wikipedia_audit_row,wikipedia,15,11,8,0,8,10,8,4,64,84.4,gold_watch_and_correct,wikipedia_mirror_kg,editors_students_journalists_ai_snippets,76,citation_audit_talk_page_packet_plus_source_chain_visual,annual remembrance page recirculates the number every May,,MILD,,,Calendar recurrence raises propagation power.
TOP-011,11,SEO-N011,Everything Explained Mullivaikkal massacre,https://everything.explained.today/Mullivaikkal_massacre/,mirror,seo_mirror,8,14,15,0,8,6,8,4,63,78.8,gold_watch_and_correct,other_surface,general_search_readers,69,evidence_packet_link,duplicates 40000-70000 fatalities framing,,YES,,,Copy-mirror that inflates apparent source plurality.
TOP-024,24,SEO-N024,Tamil Guardian remembrance coverage 2026,https://www.tamilguardian.com/content/pictures-tamil-genocide-remembrance-day-commemorated-mullivaikkal-0,article,tamil_media_community,15,12,15,0,3,6,8,4,63,78.8,gold_watch_and_correct,source_authority,diaspora_community_readers_campaigners,76,editor_note_pitch_with_precise_safe_wording,169796 unaccounted and presumed dead,,YES,,,Community-media amplification of higher number.
TOP-050,50,SEO-N050,Wikipedia Sri Lankan civil war,https://en.wikipedia.org/wiki/Sri_Lankan_civil_war,hub,wikipedia_broad_hub,15,12,15,0,3,6,8,4,63,78.8,gold_watch_and_correct,wikipedia_mirror_kg,editors_students_journalists_ai_snippets,76,citation_audit_talk_page_packet_plus_source_chain_visual,"infobox and body stack 40000 killed, 70000 unaccounted, 146000 unaccounted, and 169796 killed",,YES,,,Broad-war hub with severe denominator and category risk.
TOP-012,12,SEO-N012,Amnesty Mullivaikkal 2024,https://www.amnesty.org/en/latest/news/2024/05/sri-lanka-fifteen-years-after-the-end-of-war-victims-still-await-justice-at-mullivaikkal/,article,ngo,13,12,15,0,8,2,8,4,62,73.5,gold_watch_and_correct,ngo_legal_evidence,human_rights_readers_fact_checkers_editors,73,claim_table_with_source_wording_and_category_labels,at Mullivaikkal killing at least 40000 civilians according to UN estimates,,YES,,,Reputable NGO with location compression risk.
TOP-027,27,SEO-N027,Ontario Bill 104,https://www.ola.org/en/legislative-business/bills/parliament-42/session-1/bill-104,political_recognition,host_government,14,10,15,0,3,4,8,8,62,73.5,gold_watch_and_correct,political_recognition,policy_staff_diaspora_civic_educators,72,briefing_note_for_political_recognition_vs_casualty_method,UN estimates 40000-75000 in May 2009 and other estimates 146679,,YES,,,Legislative hardening route with public-education reach.
TOP-053,53,SEO-N053,Wikipedia Sri Lanka's Killing Fields,https://en.wikipedia.org/wiki/Sri_Lanka%27s_Killing_Fields,media_hub,wikipedia,15,11,15,0,3,6,8,4,62,73.5,gold_watch_and_correct,wikipedia_mirror_kg,editors_students_journalists_ai_snippets,74,citation_audit_talk_page_packet_plus_source_chain_visual,Lankan Army killed 40000 Tamils / tens of thousands died,,YES,,,Media-summary page that pushes the number into documentary memory.
TOP-067,67,SEO-N067,UN-hosted NGO statement A/HRC/60/NGO/309,https://documents.un.org/api/symbol/access?l=en&s=A%2FHRC%2F60%2FNGO%2F309&t=pdf,ngo_statement,un_hosted_advocacy,15,9,15,0,3,4,8,8,62,73.5,gold_watch_and_correct,source_authority,general_search_readers,72,evidence_packet_link,up to 40000 civilians may have been killed and up to 175000 were killed,,YES,,,High-risk authority laundering route.
TOP-068,68,SEO-N068,UN-hosted NGO statement A/HRC/53/NGO/266,https://documents.un.org/doc/undoc/gen/g23/265/90/pdf/g2326590.pdf,ngo_statement,un_hosted_advocacy,15,9,15,0,3,4,8,8,62,73.5,gold_watch_and_correct,source_authority,general_search_readers,72,evidence_packet_link,more than 169000 innocent Tamil people,,YES,,,UN domain gives heavy authority to advocacy language.
TOP-022,22,SEO-N022,Genocide Against Tamils Mullivaikkal,https://genocideagainsttamils.com/massacres/mullivaikkal-2009/,advocacy,seo_memorial,10,10,15,0,8,2,8,8,61,68.6,gold_watch_and_correct,advocacy_memorial,diaspora_community_readers_campaigners,66,claim_table_with_source_wording_and_category_labels,UN Panel up to 40000 alongside 70000 style framing,,YES,,,Memorial SEO taxonomy node.
TOP-036,36,SEO-N036,Wiki2 Mullivaikkal massacre,https://wiki2.org/en/Mullivaikkal_massacre,mirror,seo_mirror,8,12,15,0,8,6,8,4,61,68.6,gold_watch_and_correct,other_surface,general_search_readers,65,evidence_packet_link,between 40000 and 70000 entrapped Tamil civilians were killed,,YES,,,High-visibility mirror that repackages Wikipedia prose.
TOP-040,40,SEO-N040,PEARL 2021 remembrance statement,https://pearlaction.org/tamil-genocide-remembrance-day-2021/,advocacy,diaspora_advocacy,10,8,15,0,3,8,8,8,60,64.0,gold_watch_and_correct,advocacy_memorial,diaspora_community_readers_campaigners,63,claim_table_with_source_wording_and_category_labels,UN estimated 40000 civilians killed and others estimate 146679 unaccounted for,,YES,,,Combines authoritative upper estimate with higher unaccounted route.
TOP-074,74,TG-003,Tamil genocide / frame_effect,https://en.wikipedia.org/wiki/Tamil_genocide,wikipedia_audit_row,wikipedia,15,11,8,0,8,6,8,4,60,64.0,gold_watch_and_correct,wikipedia_mirror_kg,editors_students_journalists_ai_snippets,73,citation_audit_talk_page_packet_plus_source_chain_visual,genocide frame wraps disputed casualty clusters,,MIXED,,,Page is powerful even when individual citations exist.
TOP-004,4,SEO-N004,Wikipedia Panel report page,https://en.wikipedia.org/wiki/Report_of_the_Secretary-General%27s_Panel_of_Experts_on_Accountability_in_Sri_Lanka,hub,wikipedia,15,15,8,0,3,6,8,4,59,59.7,green_context_or_source_safe,wikipedia_mirror_kg,editors_students_journalists_ai_snippets,77,citation_audit_talk_page_packet_plus_source_chain_visual,as many as 40000 may have been killed,,MILD,,,Root interpreter page for non-specialists.
TOP-029,29,SEO-N029,Viral Sinhala Facebook post,local:screenshot,viral_social,social,7,8,15,0,8,5,8,8,59,59.7,green_context_or_source_safe,social_video,social_users_creators_commenters,58,short_shareable_fact_check_card_and_comment_template,UN Gaza accepted but 40000 Mullivaikkal rejected,,YES,,,Live object of inquiry; source trail still unproven.
TOP-039,39,SEO-N039,CIPDH Mullivaikkal remembrance page,https://www.cipdh.gob.ar/memorias-situadas/en/lugar-de-memoria/mullivaikkal-remembrance-day/,institutional_memorial,international_memorial_institution,10,8,15,0,8,6,8,4,59,59.7,green_context_or_source_safe,advocacy_memorial,diaspora_community_readers_campaigners,62,evidence_packet_link,an estimated 40000 Tamil civilians were massacred in the final stages of the war,,YES,,,Institutional memorial authority turns estimate into declarative prose.
TOP-041,41,SEO-N041,PEARL 2024 justice-for-genocide summary,https://pearlaction.org/wp-content/uploads/2024/09/Justice-for-Genocide-Sri-Lankas-Responsibility-for-Genocide-Against-the-Tamil-People-in-2009.pdf,advocacy,diaspora_advocacy,10,8,15,0,8,2,8,8,59,59.7,green_context_or_source_safe,advocacy_memorial,diaspora_community_readers_campaigners,62,claim_table_with_source_wording_and_category_labels,as many as 40000 Tamils killed and up to 169796 unaccounted for,,YES,,,Major legal-advocacy synthesis node.
TOP-044,44,SEO-N044,Reddit r/srilanka thread 2026,https://www.reddit.com/r/srilanka/comments/1tgd35u/lets_get_this_straight_if_youre_here_to_troll_or/,social_forum,social,7,8,15,0,8,5,8,8,59,59.7,green_context_or_source_safe,social_video,social_users_creators_commenters,58,short_shareable_fact_check_card_and_comment_template,UN estimates 40000-70000 Tamil civilians were killed,,YES,,,"Comments partly correct the number, but OP carries compressed range."
TOP-065,65,SEO-N065,US House Resolution 1230,https://www.congress.gov/bill/118th-congress/house-resolution/1230/text,political_recognition,host_government,14,9,8,0,8,4,8,8,59,59.7,green_context_or_source_safe,political_recognition,policy_staff_diaspora_civic_educators,69,briefing_note_for_political_recognition_vs_casualty_method,hundreds of thousands of lives lost including the Tamil Genocide,,MIXED,,,Broad-war/genocide label expansion in U.S. political space.
TOP-046,46,SEO-N046,Google Groups Tamil forum mirror,https://groups.google.com/g/thiru-thoazhamai/c/UbDzzloaOV0,forum_archive,social_archive,7,8,15,0,3,9,8,8,58,55.7,green_context_or_source_safe,social_video,social_users_creators_commenters,57,short_shareable_fact_check_card_and_comment_template,UN estimate more than 40000; Petrie more than 70000,,YES,,,Bundles multiple routes into one archive thread.
TOP-020,20,SEO-N020,PEARL genocide legal brief,https://pearlaction.org/genocide-legal-briefing/,advocacy,diaspora_advocacy,13,10,8,0,8,2,8,8,57,52.0,green_context_or_source_safe,advocacy_memorial,diaspora_community_readers_campaigners,67,claim_table_with_source_wording_and_category_labels,reasonable grounds to believe genocide,,MIXED,,,Legal advocacy argument; not a tribunal finding.
TOP-021,21,SEO-N021,ITJP death toll brief,https://itjpsl.com/assets/ITJP_death_toll_A4_v6.pdf,report,advocacy_data,10,10,15,0,3,2,8,8,56,48.5,green_context_or_source_safe,ngo_legal_evidence,human_rights_readers_fact_checkers_editors,62,evidence_packet_link,169796 killed or unaccounted route,,YES,,,High-number model route with strong propagation potential.
TOP-023,23,SEO-N023,Tamil Conferences declaration,https://tamilconferences.org/consensus/declaration-of-common-principles-of-tamils/,advocacy,movement_consensus,10,10,15,0,3,2,8,8,56,48.5,green_context_or_source_safe,other_surface,diaspora_community_readers_campaigners,62,claim_table_with_source_wording_and_category_labels,UN 40000 plus 70000 and 146679,,YES,,,"Political consensus document, not neutral audit."
TOP-051,51,SEO-N051,Wikipedia Petrie report page,https://en.wikipedia.org/wiki/Secretary-General%27s_Internal_Review_Panel_on_United_Nations_Action_in_Sri_Lanka,hub,wikipedia_report_interpreter,15,11,8,0,3,6,8,4,55,45.3,green_context_or_source_safe,wikipedia_mirror_kg,editors_students_journalists_ai_snippets,70,citation_audit_talk_page_packet_plus_source_chain_visual,could have been as many as 40000 civilian deaths; other sources say over 70000 unaccounted,,MILD,,,Important because a report-summary page itself bundles multiple numeric lanes.
TOP-054,54,SEO-N054,Wikipedia The Cage by Gordon Weiss,https://en.wikipedia.org/wiki/The_Cage_%28Weiss_book%29,book_node,wikipedia,15,11,8,0,3,6,8,4,55,45.3,green_context_or_source_safe,wikipedia_mirror_kg,editors_students_journalists_ai_snippets,70,citation_audit_talk_page_packet_plus_source_chain_visual,up to 40000 civilians may have been killed in the final stages,,MILD,,,Bridge into the Gordon Weiss popularization lane.
TOP-057,57,SEO-N057,Fandom war-crimes mirror,https://military-history.fandom.com/wiki/War_crimes_during_the_final_stages_of_the_Sri_Lankan_Civil_War,mirror,seo_mirror,8,11,15,0,3,6,8,4,55,45.3,green_context_or_source_safe,other_surface,general_search_readers,60,evidence_packet_link,40000 civilians killed / 146000 unaccounted / 169796 killed,,YES,,,Mirror/fandom route with category collapse.
TOP-100,100,VP-002,Buwanaka Sagindra Perera viral post numeric claim,local:screenshot_and_user_supplied_pdf,local_social_object,facebook/local,7,7,15,0,8,2,8,8,55,45.3,green_context_or_source_safe,other_surface,general_search_readers,54,evidence_packet_link,The UN says more than 40000 civilians died in Mullivaikkal.,,YES,,,Overstated as written if read as literal UN-backed Mullivaikkal-only claim.
TOP-002,2,SEO-N002,Petrie/Internal Review,https://digitallibrary.un.org/record/737299/files/The_Internal_Review_Panel_report_on_Sri_Lanka.pdf,source,UN,15,14,8,0,3,2,8,4,54,42.2,green_context_or_source_safe,source_authority,general_search_readers,73,evidence_packet_link,UN failure / under-reporting / later 70000 unaccounted route,,MIXED,,,Important for missing/unaccounted route and accountability context.
TOP-045,45,SEO-N045,Reddit r/srilanka explainer 2025,https://www.reddit.com/r/srilanka/comments/1j8wsym/what_is_mullivaikal_massacre/,social_forum,social,7,8,15,0,3,5,8,8,54,42.2,green_context_or_source_safe,social_video,social_users_creators_commenters,54,short_shareable_fact_check_card_and_comment_template,UN reports civilian deaths at 40000; groups say 70000-100000,,YES,,,Forum explainer turns layered estimates into simple ladder.
TOP-048,48,SEO-N048,Ilankai Tamil Sangam Amnesty repost,https://sangam.org/amnesty-fifteen-years-after-the-end-of-war-victims-still-await-justice-at-mullivaikkal/,repost,diaspora_archive,10,8,15,0,3,2,8,8,54,42.2,green_context_or_source_safe,advocacy_memorial,diaspora_community_readers_campaigners,59,claim_table_with_source_wording_and_category_labels,killing at least 40000 civilians according to UN estimates,,YES,,,Repost/archival amplification of Amnesty wording.
TOP-049,49,SEO-N049,Maktoob Media remembrance explainer,https://maktoobmedia.com/public/post?id=102537&slug=why-may-18-is-marked-as-tamil-genocide-remembrance-day,article,indian_media_social_bridge,12,8,8,0,3,6,8,8,53,39.4,green_context_or_source_safe,social_video,social_users_creators_commenters,61,short_shareable_fact_check_card_and_comment_template,40000 civilians may have died,,MILD,,,Bridge node into X/share surfaces.
TOP-082,82,SERP-082,Tamil genocide Wikipedia and Tamil Guardian style pages appear high,https://en.wikipedia.org/wiki/Tamil_genocide,wikipedia,wikipedia,15,11,0,0,8,6,8,4,52,36.8,green_context_or_source_safe,wikipedia_mirror_kg,editors_students_journalists_ai_snippets,68,citation_audit_talk_page_packet_plus_source_chain_visual,Tamil genocide Wikipedia and Tamil Guardian style pages appear high,,UNKNOWN,,,Search result itself says estimated 40000 Tamil civilians killed.
TOP-083,83,SERP-083,Mullivaikkal massacre Wikipedia and mirrors/advocacy surfaces appear,https://en.wikipedia.org/wiki/Mullivaikkal_massacre,wikipedia,wikipedia,15,11,0,0,8,6,8,4,52,36.8,green_context_or_source_safe,wikipedia_mirror_kg,editors_students_journalists_ai_snippets,68,citation_audit_talk_page_packet_plus_source_chain_visual,Mullivaikkal massacre Wikipedia and mirrors/advocacy surfaces appear,,UNKNOWN,,,Current page infobox/lead use 40000-70000 fatalities.
TOP-008,8,SEO-N008,Wikipedia Casualties of Sri Lankan civil war,https://en.wikipedia.org/wiki/Casualties_of_the_Sri_Lankan_civil_war,hub,wikipedia,15,15,0,0,3,6,8,4,51,34.3,green_context_or_source_safe,wikipedia_mirror_kg,editors_students_journalists_ai_snippets,72,citation_audit_talk_page_packet_plus_source_chain_visual,multiple casualty ranges including 40000 70000 and 169796,,NO,,,Numeric aggregator with category-mixing risk.
TOP-009,9,SEO-N009,Wikipedia War crimes during final stages,https://en.wikipedia.org/wiki/War_crimes_during_the_final_stages_of_the_Sri_Lankan_civil_war,hub,wikipedia,15,15,0,0,3,6,8,4,51,34.3,green_context_or_source_safe,wikipedia_mirror_kg,editors_students_journalists_ai_snippets,72,citation_audit_talk_page_packet_plus_source_chain_visual,war-crimes pattern page with many accountability sources,,NO,,,Important hub even when not the main casualty page.
TOP-013,13,SEO-N013,HRW commentary 2024,https://www.hrw.org/news/2024/05/14/15-years-sri-lankas-conflict-ended-no-justice-war-crimes,article,ngo,13,12,8,0,3,2,8,4,50,32.0,green_context_or_source_safe,ngo_legal_evidence,human_rights_readers_fact_checkers_editors,65,claim_table_with_source_wording_and_category_labels,up to 40000 civilians were killed in the final months,,MILD,,,Cleaner than Mullivaikkal-only wording; still derivative.
TOP-017,17,SEO-N017,Lord Naseby Hansard 2017,https://hansard.parliament.uk/Lords/2017-10-12/debates/14CAA83D-8895-4182-8C4F-D964E0A5B399/SriLanka,political_counter,host_political_counter,15,12,0,0,3,4,8,8,50,32.0,green_context_or_source_safe,source_authority,policy_staff_diaspora_civic_educators,68,briefing_note_for_political_recognition_vs_casualty_method,lower-count public argument using leaked dispatch framing,,NO,,,Political echo of lower-count critique.
TOP-037,37,SEO-N037,Sri Lanka Brief dead and missing route,https://srilankabrief.org/sri-lankas-dead-and-missing-the-need-for-an-accounting/,article,republished_ngo_media,15,10,8,0,3,2,8,4,50,32.0,green_context_or_source_safe,ngo_legal_evidence,human_rights_readers_fact_checkers_editors,66,claim_table_with_source_wording_and_category_labels,70000 people unaccounted for,,MIXED,,,Accounting-oriented but often read as a death-count lane.
TOP-058,58,SEO-N058,MFA rebuttal to Tamil genocide claim,https://mfa.gov.lk/en/tamil-genocide-sl/,official_counter,state_official,15,9,0,0,8,2,8,8,50,32.0,green_context_or_source_safe,counter_route,sri_lankan_civic_readers_state_media_counter_campaigns,64,counter_route_audit_showing_lower_count_limits,hypothetical figure of 40000 civilian deaths,,NO,,,High-value official counter-route.
TOP-055,55,SEO-N055,Wikipedia Lies Agreed Upon,https://en.wikipedia.org/wiki/Lies_Agreed_Upon,counter_media_hub,wikipedia,15,13,0,0,3,6,8,4,49,29.9,grey_low_or_supporting,wikipedia_mirror_kg,editors_students_journalists_ai_snippets,68,citation_audit_talk_page_packet_plus_source_chain_visual,counter-claims cite about 7000 casualties and challenge 40000,,NO,,,Useful to map how counter-propagation works.
TOP-092,92,SERP-092,PEARL and Tamil Guardian style routes appear around ITJP language,https://pearlaction.org/tamil-genocide-remembrance-day-2021/,advocacy/community,advocacy/community,15,9,0,0,3,6,8,8,49,29.9,grey_low_or_supporting,source_authority,diaspora_community_readers_campaigners,64,claim_table_with_source_wording_and_category_labels,PEARL and Tamil Guardian style routes appear around ITJP language,,UNKNOWN,,,Category label must remain visible because many results merge killed and unaccounted.
TOP-016,16,SEO-N016,Paranagama second mandate,https://www.parliament.lk/uploads/documents/paperspresented/report-of-paranagama.pdf,report,state_or_domestic_commission,14,10,0,0,3,4,8,8,47,26.0,grey_low_or_supporting,counter_route,sri_lankan_civic_readers_state_media_counter_campaigns,62,counter_route_audit_showing_lower_count_limits,rejects higher estimates and cites lower external routes,,NO,,,Adversarial lower-count lane.
